{
  "ledger_record_id": "ledger_retail_001",
  "ledger_id": "retail_decision_ledger",
  "recorded_at": "2026-03-16T10:15:03Z",
  "record_type": "DECISION_TRACE",
  "domain": "retail",

  "trace": {
    "trace_id": "trace_retail_001",
    "trace_version": "1.0",
    "timestamp": "2026-03-16T10:15:00Z",
    "domain": "retail",
    "status": "SUCCESS",
    "event": {
      "event_id": "promotion_request_001",
      "type": "store_promotion",
      "timestamp": "2026-03-16T10:14:00Z",
      "source": "store_ops_system",
      "payload": {
        "store_id": "TOKYO_01",
        "promotion_type": "discount_coupon"
      }
    },
    "signals": [
      {
        "signal_id": "sig_inventory_001",
        "name": "inventory_risk",
        "value": "high",
        "value_type": "string",
        "source": "rule_engine",
        "timestamp": "2026-03-16T10:14:20Z"
      },
      {
        "signal_id": "sig_saleslift_001",
        "name": "expected_sales_lift",
        "value": 0.25,
        "value_type": "number",
        "source": "sales_forecast_model",
        "confidence": 0.78,
        "timestamp": "2026-03-16T10:14:24Z"
      }
    ],
    "contract_evaluation": {
      "contract_id": "contract_retail_001",
      "contract_name": "Store Promotion Contract",
      "contract_version": "1.0",
      "result": "MATCHED",
      "rules_evaluated": [
        {
          "rule_id": "rule_inventory_high",
          "expression": "inventory_risk == 'high'",
          "result": true,
          "inputs": ["inventory_risk"],
          "action": "apply_discount"
        }
      ],
      "selected_outcome": "APPLY_PROMOTION"
    },
    "behavior_tree_execution": {
      "tree_id": "bt_retail_001",
      "tree_name": "Store Promotion Flow",
      "tree_version": "1.0",
      "result": "SUCCESS",
      "path": [
        {
          "node_id": "root_selector",
          "node_name": "Promotion Selector",
          "node_type": "Selector",
          "status": "SUCCESS",
          "timestamp": "2026-03-16T10:14:40Z"
        },
        {
          "node_id": "inventory_check",
          "node_name": "Inventory Risk Check",
          "node_type": "Condition",
          "status": "SUCCESS",
          "condition_result": true,
          "timestamp": "2026-03-16T10:14:41Z"
        },
        {
          "node_id": "apply_discount_action",
          "node_name": "Apply Discount",
          "node_type": "Action",
          "status": "SUCCESS",
          "action_result": "APPLY_PROMOTION",
          "timestamp": "2026-03-16T10:14:42Z"
        }
      ]
    },
    "boundary_checks": [
      {
        "boundary_id": "boundary_budget_001",
        "name": "Campaign Budget Check",
        "boundary_type": "policy_guard",
        "result": "PASS",
        "reason": "Budget remains within campaign allocation"
      },
      {
        "boundary_id": "boundary_store_policy_001",
        "name": "Store Promotion Policy Check",
        "boundary_type": "compliance_check",
        "result": "PASS",
        "reason": "Promotion allowed for this store segment"
      }
    ],
    "human_review": {
      "required": false,
      "review_status": "NOT_REQUIRED"
    },
    "decision": {
      "outcome": "APPLY_PROMOTION",
      "decision_type": "automated",
      "reason": "High inventory risk triggered promotion flow",
      "issued_by": "engine",
      "confidence": 0.78
    },
    "ledger_context": {
      "ledger_id": "retail_decision_ledger",
      "recorded_at": "2026-03-16T10:15:03Z",
      "ledger_backend": "file",
      "immutable": true,
      "engine_version": "0.1"
    }
  },

  "immutability": {
    "append_only": true,
    "immutable": true,
    "correction_policy": "CORRECT_BY_NEW_RECORD"
  },

  "integrity": {
    "hash_algorithm": "SHA-256",
    "record_hash": "sha256:retail-example-record-hash",
    "previous_record_hash": "sha256:previous-retail-record-hash"
  },

  "lineage": {
    "previous_ledger_record_id": "ledger_retail_000"
  },

  "versions": {
    "trace_schema_version": "1.0",
    "ledger_schema_version": "1.0",
    "engine_version": "0.1",
    "contract_version": "1.0",
    "behavior_tree_version": "1.0",
    "ontology_version": "1.0",
    "model_version": "sales_forecast_model_v1"
  },

  "storage": {
    "backend": "file",
    "location": "ledger/retail.jsonl",
    "partition_key": "retail",
    "retention_policy": "permanent"
  },

  "access_control": {
    "classification": "internal",
    "owner": "store_operations_team",
    "allowed_roles": ["store_manager", "marketing_ops", "auditor"],
    "redaction_required": false
  },

  "audit_metadata": {
    "recorded_by": "decision-trace-engine",
    "recorded_by_type": "engine",
    "reason": "automatic recording after store promotion workflow",
    "correlation_id": "corr_retail_001",
    "request_id": "req_retail_001"
  },

  "attachments": [
    {
      "type": "report",
      "path": "reports/promotion_request_001.json",
      "description": "Promotion request summary"
    }
  ]
}
